{
  "name": "supabase",
  "category": "data",
  "description": "Manage Supabase projects: inspect PostgreSQL tables, query Auth users, review Storage buckets, inspect Edge Functions, and check database migrations.",
  "license": "MIT",
  "command": "npx",
  "args": ["-y", "@supabase/mcp-server"],
  "env": {
    "SUPABASE_ACCESS_TOKEN": "<your-supabase-access-token>"
  },
  "metadata": {
    "version": "v1",
    "publisher": "carthworks",
    "tags": ["supabase", "postgres", "auth", "database", "baas"],
    "runtime": "node",
    "officialUrl": "https://github.com/supabase-community/supabase-mcp"
  }
}
