{
  "name": "sentry",
  "category": "quality",
  "description": "Retrieve and inspect real-time application crash reports, error stack traces, breadcrumbs, and issue telemetry directly from Sentry projects.",
  "license": "MIT",
  "command": "uvx",
  "args": ["mcp-server-sentry", "--auth-token", "<your-sentry-auth-token>"],
  "env": {
    "SENTRY_AUTH_TOKEN": "<your-sentry-auth-token>"
  },
  "metadata": {
    "version": "v1",
    "publisher": "carthworks",
    "tags": ["sentry", "monitoring", "errors", "debug", "quality"],
    "runtime": "python",
    "officialUrl": "https://github.com/modelcontextprotocol/servers/tree/main/src/sentry"
  }
}
